{
  "$schema": "../../schemas/resource.schema.json",
  "id": "camel-tools",
  "name": "CAMeL Tools",
  "description": "Comprehensive Arabic NLP toolkit by NYU Abu Dhabi. Provides morphological analysis, dialect identification, named entity recognition, sentiment analysis, and text utilities for Modern Standard Arabic and Classical Arabic — directly applicable to Quranic and hadith text processing.",
  "category": "general",
  "url": "https://pypi.org/project/camel-tools/",
  "docs": "https://camel-tools.readthedocs.io",
  "repo": "https://github.com/CAMeL-Lab/camel_tools",
  "license": "MIT",
  "languages": ["ar"],
  "format": "pip",
  "free": true,
  "auth_required": false,
  "scholar_reviewed": false,
  "maintained": true,
  "tags": ["arabic", "nlp", "morphology", "classical-arabic", "quran", "python", "ner"],
  "added": "2026-06-14",
  "attribution": "NYU Abu Dhabi CAMeL Lab"
}
